{
  "$schema": "https://json-schema.org/draft/2020-12/schema",
  "$id": "https://xianxia-engine.com/schemas/faction_model.json",
  "title": "Faction Model Schema",
  "description": "Schema for faction system definitions",
  "type": "object",
  "required": ["meta", "faction_tiers", "faction_types", "faction_templates"],
  "properties": {
    "meta": {"$ref": "#/$defs/metaInfo"},
    "faction_tiers": {
      "type": "object",
      "patternProperties": {
        "^tier_\\d+$": {
          "type": "object",
          "required": ["name", "description", "requirements"],
          "properties": {
            "name": {"type": "string"},
            "description": {"type": "string"},
            "requirements": {"type": "object"},
            "benefits": {"type": "object"}
          }
        }
      }
    },
    "faction_types": {
      "type": "object",
      "additionalProperties": {
        "type": "object",
        "required": ["id", "name", "alignment", "structure"],
        "properties": {
          "id": {"type": "string"},
          "name": {"type": "string"},
          "alignment": {"type": "string"},
          "structure": {"type": "string"},
          "recruitment": {"type": "object"},
          "focus": {"type": "array", "items": {"type": "string"}},
          "special": {"type": "object"}
        }
      }
    },
    "faction_templates": {
      "type": "array",
      "items": {
        "type": "object",
        "required": ["id", "name", "type", "tier", "influence", "wealth"],
        "properties": {
          "id": {"type": "string"},
          "name": {"type": "string"},
          "type": {"type": "string"},
          "tier": {"type": "integer"},
          "description": {"type": "string"},
          "founding_date": {"type": "integer"},
          "headquarters": {"type": "string"},
          "influence": {"type": "integer"},
          "wealth": {"type": "integer"},
          "members": {"type": "object"},
          "leadership": {"type": "object"},
          "resources": {"type": "object"},
          "tech_tree": {"type": "object"},
          "relationships": {"type": "object"},
          "recruitment_formula": {"type": "string"},
          "contribution_system": {"type": "object"},
          "faction_skills": {"type": "array"},
          "territory": {"type": "object"},
          "events": {"type": "object"}
        }
      }
    },
    "faction_mechanics": {"type": "object"},
    "faction_positions": {"type": "object"},
    "_custom_tags": {"$ref": "#/$defs/customTags"}
  },
  "$defs": {
    "metaInfo": {
      "type": "object",
      "required": ["version", "description", "schema_version"],
      "properties": {
        "version": {"type": "string", "pattern": "^\\d+\\.\\d+\\.\\d+$"},
        "description": {"type": "string"},
        "schema_version": {"type": "string"},
        "last_modified": {"type": "string", "format": "date"}
      }
    },
    "customTags": {
      "type": "array",
      "items": {"type": "string"}
    }
  }
}